{
    "ID": "FF7C33A486FC4C619AE002CECA7571F8",
    "Name": "SearchEngines",
    "ActionKeyword": "?!",
    "IsGlobal": false,
    "Disabled": false,
    "Author": "Shresht7",
    "Version": "0.4.0",
    "Website": "https://github.com/Shresht7/PowerToysRun-SearchEngines",
    "Language": "csharp",
    "ExecuteFileName": "Community.PowerToys.Run.Plugin.SearchEngines.dll",
    "IcoPathDark": "Images\\icon.dark.png",
    "IcoPathLight": "Images\\icon.light.png"
}
